results/model_evaluation_results.csv

Model,BLEU-1,BLEU-4,Parameters
GRU-512 (Frozen CNN),0.2903999550439259,0.05034303496257492,5093993
LSTM-512 (Frozen CNN),0.2280076700438029,0.03752206691035485,5881449
GRU-256 (Frozen CNN),0.22272808741563585,0.03543543804210762,3165289
GRU-512 (Fine-tuned CNN),0.23491317835619757,0.04153495954229201,5093993

README.md

# Experiment 3: CNN Tuning Comparison

The models/ folder contains 4 pre-trained models with the following performance:
Model	Description	BLEU-1	BLEU-4
exp1_gru.pth	GRU decoder, 512 hidden, frozen CNN	0.2904	0.0503
exp1_lstm.pth	LSTM decoder, 512 hidden, frozen CNN	0.2280	0.0375
exp2_gru_256.pth	GRU decoder, 256 hidden, frozen CNN	0.2227	0.0354
exp3_finetuned.pth	GRU decoder, 512 hidden, fine-tuned CNN	0.2349	0.0415